AppliedSchool,Degree,Major,Result,Year,EnglishLevel,TOEFL,IELTS,GRE,School,SchoolMajor,GPA,PostSchool,PostMajor,PostGPA,Other_Info
佐治亚理工学院,博士,Chemical Engineering,被拒,2015,0,,,318,211,化学工程与工艺,84,国外高校（含港澳台）,chemical engineering,88,无套磁，无Paper
佐治亚理工学院,硕士,Environmental Engineering,被拒,2015,1,88,,312,211,环境工程,84,,,,无论文，校级科研项目，跟着导师在做他的国家自然基金项目，PS中有细说。无牛推，一导师，一本校系主任，一外校中国教授。无竞赛获奖，有学生会经历，志愿者经历。总之背景很薄弱，只是手头有个项目在写论文。
佐治亚理工学院,硕士,Finance,被拒,2015,4,110,,322,浙大/复旦/南大/南开/武大/华中科大/上海交大/天大,经济学,84,,,,
佐治亚理工学院,博士,Chemistry,被拒,2017,3,101,,322,,物化,84,,,,
佐治亚理工学院,博士,Bioengineering and Biomedical Engineering,被拒,2016,0,,,329,双非,微生物工程,85.6,,生物工程,90,国内普通学校本科，美国普通学校硕士，申请时发表 SCI 一作 5篇。
佐治亚理工学院,硕士,Digital Media,被拒,2016,3,100,,313,211 & 985,新闻,86,,,,两个院级奖学金。辅修计算机，分别在网易、本地纸媒和东软集团实习半年、2个月和3个月。无论文，一个水大创。推荐信是实习老师和学院两位老师。
佐治亚理工学院,博士,Chemical Engineering,被拒,2016,3,105,,320,211 & 985,化学工程与工艺,87.42,,,,"三篇SCI挂名,一篇5作(2个通讯），两篇6作（一篇2个通讯，另一篇1个通讯）---这样写是因为不知道通讯作者算不算作者的排名里= =
负责一个国家级大学生创新项目，前后在实验室待了一年；现在到国内top2做毕设的经历也写在简历里了。"
佐治亚理工学院,博士,Chemistry,被拒,2017,3,107,,324,211 & 985,化学,88,,,,
佐治亚理工学院,硕士,Public Policy Analysis,被拒,2017,3,103,,318,211,商务英语&法学,88,,,,无论文  无牛推     一个政府实习   一个律所实习
佐治亚理工学院,博士,Bioengineering and Biomedical Engineering,被拒,2017,3,108,,324,浙大/复旦/南大/南开/武大/华中科大/上海交大/天大,声学,88,,,,NCSU暑期科研，一篇APL二作，一篇会议水文挂名，一篇会议水oral一作
佐治亚理工学院,博士,Psychology,被拒,2015,3,105,,325,清华/北大/中科大,新闻,88,,,,
佐治亚理工学院,博士,Chemical Engineering,被拒,2015,3,101,,323,,应用化学,88,,,,
佐治亚理工学院,硕士,Operation Research,被拒,2017,3,101,,321,211 & 985,金融工程,88.05,,,,
佐治亚理工学院,博士,Electrical and Electronics Engineering,被拒,2017,0,,,320,国外高校（含港澳台）,Physics,90,,,,无论文发表。两段主要研究经历：quantum optics 跟 condensed matter experiment
佐治亚理工学院,博士,Electrical and Electronics Engineering,被拒,2017,3,101,,321,211 & 985,微电子学,91,浙大/复旦/南大/南开/武大/华中科大/上海交大/天大,微电子学与固体电子学,84,"本科生：一个本科生科研项目组长，一个公司举办的电子竞赛优胜赛普通成员（就是那种最水的奖），美模一等奖普通成员（也是比较水的）
研究生：老板手下的若干经历，一篇会议一作（EI检索），一篇期刊一作（SCI检索），一个国内专利二作
若干奖学金，港科还挺看重国奖的
无牛腿"
佐治亚理工学院,硕士,Electrical and Electronics Engineering,被拒,2017,3,101,,325,211 & 985,应用物理学,91,,,,"台湾交通大学一学期交换, 92.22/100"
佐治亚理工学院,博士,Chemistry,被拒,2016,2,96,,318,211 & 985,化学,92,,,,一个二作，几篇马上投出去的文章。本科科研经历丰富，有八九个课外科研课题。有过三个月的海外暑期科研经历，不过去的是美国很破的学校。还有五六个没信的学校。纠结起来。
佐治亚理工学院,博士,Chemical Engineering,被拒,2017,3,104,,332,浙大/复旦/南大/南开/武大/华中科大/上海交大/天大,分子科学与工程,92,,,,
佐治亚理工学院,博士,Environmental Engineering,被拒,2015,3,109,,326,国外高校（含港澳台）,环境工程,93,,,,3年实验室经验，一篇sci 3作，系里教授三篇推荐信，申的都是PhD，目前offer木有。。。有的都是被降级了。。
佐治亚理工学院,本科,Chemistry,被拒,2017,3,103,,320,双非,化学,94,,,,有国家奖学金，申报过一个课题，不过合成产率很低，算是失败了，没有论文
新加坡国立大学,博士,Chinese Studies,录取,2017,3,,7,0,211 & 985,历史,84,,宗教研究,90,本科一篇二作的核心期刊，研究生一篇会议论文，大量田野经验。
塔夫茨大学,硕士,Epidemiology,录取,2016,3,101,,321,211 & 985,Public Health,82,,,,有几个水水的科研经历，CDC、医院实习经历，PS里写了一些自己对专业的理解，觉得能被密歇根录取或许是找了一个比较牛的教授写了推荐信
伦敦大学国王学院,硕士,War Studies,录取,2015,4,111,8,327,211 & 985,英语,84,,,,一个外事口部委实习；两个省级厅局实习，其中一个为外事口；一个军方/政府背景科研院所实习；一个著名高校科研院所实习；活动若干，包括牛津模联以及斯坦福中美学生论坛的之类的；特大能源央企（副部级）在职，WE<1y；科研是神马...
香港中文大学,硕士,Journalism and Mass Communication,录取,2013,3,100,,310,双非,广告学,88,,,,"211 985
AIESEC一个半月国外实习
国内PR小公司实习
甘肃支教
地方小电视台实习"
香港浸会大学,硕士,International Journalism Studies,录取,2016,3,102,,0,211,英语专业,84,211,,,
田纳西大学,硕士,Ecology and Evolutionary Biology,录取,2016,2,91,,320,双非,水土保持与荒漠化防治,84,211,生态学,88,国家奖学金，光华奖学金，校级奖学金
博科尼大学,硕士,Accounting and Financial Management,录取,2016,3,,7,0,211,会计,82,211,,,"奖学金
500强企业财务部实习一次
半年交换经历以及海外志愿者经历"
香港浸会大学,硕士,Education,录取,2016,0,,6,0,双非,德语,80,,,,有家教经验，支教，公立小学实习。
福特汉姆大学,硕士,Social Science Research Methods,录取,2015,3,100,,319,双非,应用心理,84,,,,有篇会议论文~
新南威尔士大学,硕士,Law,录取,2016,2,97,,0,双非,,84.01,211 & 985,法律硕士,83.8,"三年半检察院经验 律所实习
一封耶鲁SJD推荐信
一封领导推荐信"
兰卡斯特大学,硕士,Business Administration and Management,录取,2016,3,,7,0,211 & 985,英语（对外汉语）,88,,,,酒店人力资源实习一个，香港交换经历，三等奖学金＊2，校园活动丰富
香港中文大学,硕士,Journalism,录取,2017,2,,6.5,0,211 & 985,会计学,87.6,,,,均分88 三段媒体实习 几个小奖 雅思比较低
南加州大学,硕士,Spatial Informatics,录取,2016,2,97,,320,浙大/复旦/南大/南开/武大/华中科大/上海交大/天大,地理信息系统,92,,,,
香港浸会大学,硕士,Operational Research and Risk Analysis,录取,2016,3,,7,0,双非,国际贸易,84,,,,
都柏林圣三一学院,硕士,Economics,录取,2013,0,,,0,国外高校（含港澳台）,会计,84,,,,
香港城市大学,硕士,Social Work,录取,2017,3,,7,0,双非,对外汉语,84.46,,TESOL,84,
德克萨斯农工大学,硕士,Architectural Sciences and Technology,录取,2015,2,99,,313,211,建筑,81,,,,
南佛罗里达大学,博士,Oceanography,录取,2013,3,102,,321,浙大/复旦/南大/南开/武大/华中科大/上海交大/天大,Remote Sensing,84,浙大/复旦/南大/南开/武大/华中科大/上海交大/天大,Surveying,,中文核心（当时没有）
加州大学欧文分校,硕士,Biology,录取,2013,3,104,,319,浙大/复旦/南大/南开/武大/华中科大/上海交大/天大,光电,88,,,,
哈佛大学,硕士,Landscape Architecture,录取,2017,4,111,,320,,,85.75,,,,"工作几年想回学校念书了。本科建筑。gsd里面mla1ap和mdes都录了，mla给了2万的Dean's Merit Scholarship，想去mla。在寄托得到了好多信息，感谢在这里贴面经贴经验的大家！
另外求问Gsd有微信群没有？孤独的老阿姨需要找到组织。。。

今早收到MIT的信，给了6万刀的奖（带research assistant），但还是会去吸金大坑GSD吧。"
香港科技大学,硕士,China Studies,录取,2014,0,,,0,双非,汉语言文学,88,,,,美国交换1学期、一次科研、一篇水论文，无牛推
香港教育学院,硕士,Teaching English to Speakers of Other Languages,录取,2017,4,,7.5,0,双非,英语文学,84,,,,
约瑟夫傅立叶大学,硕士,Earthquake Engineering,录取,2016,4,,7.5,0,211 & 985,土木工程,88.3,,,,大三拿CSC在澳大利亚交流一学期，数学建模MCM二等奖，几个校内小奖。无论文无牛推，实习基本为零
香港理工大学,硕士,Civil Engineering,录取,2014,0,,,0,,,88,,,,
曼彻斯特大学,硕士,Technical Textiles,录取,2015,3,,7,0,双非,纺织工程,89.7,,,,"一个500强外企实习近7个月，两次工厂实习各一个月，一个专业无关的事业单位实习
在实验室跟老师打打酱油，有些参加创业，创意竞赛的小奖但无论文专利（港理工的网申没有要求交cv，推荐信。我没交，所以这些竞赛小奖在申请过程中并没有被提及……等offer的时候想想我心也是蛮大的怎么就敢不提了= =）
一次专业相关国际会议志愿者经历 学校学生干部任职加活动经历若干（弱弱的一些）
奖学金 国家励志两次 小奖若干（因为没交cv这些同样没怎么提……）"
伦敦政治经济学院,硕士,Statistics,录取,2014,0,,,0,国外高校（含港澳台）,STAT,88,,,,
香港浸会大学,硕士,Communication,录取,2016,3,,7,0,,戏剧,80,,,,
皇家墨尔本理工大学,硕士,Arts Management,录取,2016,2,90,7,320,211 & 985,德语,78,,,,
香港中文大学,硕士,Educational Psychology,录取,2013,0,,,0,双非,英语,77,,,,一个港资美资市场部实习，很弱的背景
卡尔加里大学,硕士,Electrical and Electronics Engineering,录取,2014,2,99,,323,双非,电子信息工程,88,,,,
曼彻斯特大学,硕士,Operational Research,录取,2015,3,,7,324,211 & 985,统计,86,,,,建模比赛一等奖 志愿者什么的   无实习 无论文
香港城市大学,硕士,Global Business Management,录取,2016,3,,7,0,双非,英语,85,,,,
波士顿学院,硕士,Political Science and Government,录取,2015,3,103,,0,浙大/复旦/南大/南开/武大/华中科大/上海交大/天大,政治学&世界史,84,,,,
加州大学圣地亚哥分校,博士,Photonics,录取,2015,4,112,,323,211,物理，光电子,93.7,清华/北大/中科大,物理,,直博第一年退学出国
纽约州立大学石溪分校,博士,Computational and Applied Mathematics,录取,2014,3,100,,321,清华/北大/中科大,化学,70,国外高校（含港澳台）,Chemical engineering,88,"本科国内Top2, 硕士在哥大
无研究经历, 无陶瓷, 12门数学/应数课, 8A 4A+. 难度从baby rudin到某些纯数PHD课程不等
推荐人都是上课老师, 2位正教授答应写strong rec/solid rec, 一位刚毕业的博士答应写very positive rec"
香港城市大学,硕士,Quantitative Analysis for Business,录取,2016,2,,6.5,0,211,统计学,87,,,,三年奖学金，一篇水论文，几个项目（挑战杯项目大创项目什么的）
香港中文大学,硕士,Housing Studies,录取,2014,0,,,0,浙大/复旦/南大/南开/武大/华中科大/上海交大/天大,公共管理,88,,,,"没啥可说的背景..一封院长推荐信 一封系主任推荐信。
相关实习若干. 一些小奖"
瑞典皇家理工学院,硕士,Embedded System,录取,2015,2,,6.5,0,双非,测控技术与仪器,85.1,,,,无项目，参加过一个国家级比赛，还有一个超级水的论文- -，KTH炒鸡想去robotics，，，，只是，，╮(╯▽╰)╭
伦敦大学学院,硕士,Financial Risk Management,录取,2016,4,,7.5,0,双非,金融数学,87,,,,
香港理工大学,硕士,Chinese Linguistics,录取,2017,0,,6,0,双非,汉语言文学,84,,,,校媒3年，报社实习两个月。国际汉语证书，教师资格证笔试通过。普通话二甲。
香港浸会大学,硕士,"Film, Television and New Media",录取,2015,2,,6.5,0,双非,摄影（影视制作）,92,,,,
香港理工大学,硕士,Finance,录取,2016,2,,6.5,0,,金融工程,89,,,,三年奖学金 三段水实习
香港城市大学,硕士,Electronic Information Engineering,录取,2014,1,76,,0,双非,电子信息工程,81,,,,见其他两个offer贴
多伦多大学,本科,Biology and Biological Science,录取,2016,3,103,,0,211,生物技术,88,,,,
代尔夫特理工大学,硕士,Electrical Engineering,录取,2015,3,,7,0,211 & 985,电子信息工程,86.4,,,,无牛推，水科研，无论文，其他乱七八糟的奖项估计也没啥大用(或许EIT会感兴趣。。)
香港城市大学,硕士,International Economic Law,录取,2016,2,,6.5,0,双非,法学民商法,84,,,,
阿德莱德大学,硕士,Architectural Design,录取,2017,2,,6.5,0,双非,景观建筑设计,80.7,,,,
香港城市大学,硕士,Information System Management,录取,2015,3,,7,0,,工科,84,,,,本科院校211（非985）   水实习 *2    水奖学金* 若干
埃默里大学,硕士,Biostatistics,录取,2017,2,98,,321,211 & 985,生物技术,89,,,,
香港科技大学,硕士,Engineering Enterprise Management,录取,2015,3,,7,0,,信息管理与信息系统,84,,,,国奖等等奖学金基本都有，莙政学者，五百强实习，几个项目，一直带队做志愿者，活动很多。
曼彻斯特大学,硕士,Actuarial Science,录取,2015,3,,7,0,双非,金融数学,91,,,,
威斯康星大学,博士,Operations Management,录取,2015,4,110,,330,211 & 985,管理科学,84,211 & 985,管理科学,88,有论文
爱丁堡大学,硕士,International Economic Law,录取,2017,2,,6.5,0,双非,法学,85.8,,,,雅思考成这样我都不好意思说自己是语言类院校的。国际模拟法庭比赛三等奖、全国大学生版权法征文三等奖、全国大学生英语竞赛……还是三等奖。论文两篇，普通律所法院实习。爱好写作，发过几篇文章（不过这个没啥用）。总的来说没亮点。
香港中文大学,硕士,Sustainable Tourism,录取,2014,0,,,0,双非,深圳大学 高尔夫管理,84,,,,六级518申请，非985与211，无论文，院长与实习单位上司推荐信，小实习两个~还有什么想要了解的？
杜伦大学,硕士,Law,录取,2017,4,,7.5,0,浙大/复旦/南大/南开/武大/华中科大/上海交大/天大,法学,86,,,,两个实习，三次国际商事仲裁辩论赛经历，学生组织，教授推荐信x2，
德克萨斯农工大学,博士,Mechanical Engineering,录取,2015,2,97,,322,浙大/复旦/南大/南开/武大/华中科大/上海交大/天大,工程力学,88,,,,
布里斯托大学,硕士,Economics and Econometrics,录取,2016,2,,6.5,0,双非,金融学,88,,,,"专业都是MSc in Economics,不知为何选项里没得选也不能自己改。。。
Bristol在拿到MSc offer后申MRes 同专业被拒。

背景：三篇论文，国奖，数据挖掘的全国竞赛奖项，校奖学金若干，无牛推。"
德克萨斯农工大学,硕士,Computer Science and Computer Engineering,录取,2013,0,,,317,双非,计算机科学,80,,,,
马里兰大学帕克分校,博士,Atmospheric Sciences,录取,2016,4,,7.5,320,双非,大气科学,86.13,国外高校（含港澳台）,atmospheric sciences,88,硕士期间RA
乔治城大学,硕士,International Legal Studies,录取,2017,3,107,,0,211,法学,88,,,,
乔治华盛顿大学,硕士,Law,录取,2017,3,,7,0,211,法学,84,211,法学,84,十年工作党，全职复习半个月，拿到IELTS成绩后开始上寄托学习经验然后开启了DIY的申请历程。
乔治城大学,硕士,Public Policy Analysis,录取,2016,3,105,,321,211 & 985,经济学,84,,,,
路易斯安那州立大学,硕士,Landscape Architecture,录取,2015,2,94,,0,浙大/复旦/南大/南开/武大/华中科大/上海交大/天大,城市规划,86,,,,
阿尔伯塔大学,博士,Materials Science,录取,2015,3,101,,312,211 & 985,材料科学与工程,86,211 & 985,材料科学与工程,88,实验室经历较多，但申请期间大部分文章都没见刊，所以还是多少受了一些影响。
香港浸会大学,硕士,Accounting,录取,2015,4,,7.5,0,双非,审计,84,,,,只是去了一次四大实习，其他都很水。。。
伊利诺伊大学厄巴纳-香槟分校,硕士,Human Resource Management,录取,2015,2,99,,0,211 & 985,人力资源,84,,,,gap一年申请
香港浸会大学,硕士,Information Technology,录取,2016,0,,6,0,双非,Marketing,77.19,,,,工作三年，雇主及教授推荐信各一封，职业技能证书若干，奖学金两个。
香港科技大学,博士,Computer Science and Computer Engineering,录取,2016,4,,8,0,211 & 985,物联网工程,90.98,,,,
莱斯特大学,硕士,Teaching English to Speakers of Other Languages,录取,2016,2,,6.5,0,,对外汉语,83.3,,,,
伯明翰大学,硕士,International Relations and National Security Studies,录取,2015,2,,6.5,0,211,,84,,,,无
香港大学,硕士,Architecture,录取,2015,3,,7,0,双非,金融数学,81,,,,
新加坡管理大学,硕士,Quantitative Finance,录取,2015,0,,,0,浙大/复旦/南大/南开/武大/华中科大/上海交大/天大,Physics,92,浙大/复旦/南大/南开/武大/华中科大/上海交大/天大,Physics,,"提交申请到通知，整整两个星期，一个小时都不多，觉得挺快的;
就申这一个，一直也很想去这一个;
希望女朋友NTU的offer早点到来."
香港中文大学,硕士,Electrical and Electronics Engineering,录取,2014,2,90,,0,双非,通信工程,86,,,,清华大学项目两个，本校小项目两个，世界500强公司实习经历一个，无牛推无牛论文。
明尼苏达大学双城分校,硕士,Law,录取,2017,3,,7,0,双非,,85.51,,,,
曼彻斯特大学,硕士,Business Analytics,录取,2015,2,,6.5,0,211,会计,84,,,,
香港理工大学,硕士,Translation,录取,2016,4,,8,0,双非,英语,88,,,,
香港城市大学,硕士,Marketing,录取,2014,0,,,0,浙大/复旦/南大/南开/武大/华中科大/上海交大/天大,计算机科学,84,,,,毕业5年，3年国内某知名留学咨询公司销售工作经验，无论文，无教授推荐全都是工作推荐
威廉玛丽学院,硕士,General Law,录取,2015,3,,7,0,浙大/复旦/南大/南开/武大/华中科大/上海交大/天大,法学,85,,,,
伦敦大学学院,硕士,Teaching English to Speakers of Other Languages,录取,2017,4,,7.5,0,211,英语,88,,,,
香港中文大学,硕士,Computer Science,录取,2014,1,76,,0,双非,电子信息工程,81,,,,"本科长安大学，211，成绩刚过80，我们系属于那种很苛刻的，成绩都压得很低，虽然我排名也不高。托福没过，用的六级，494 三年校内小奖。实践类的做过兼职，带过支教队，实习过嵌入式公司。数学建模省二，省内五校联赛TI杯三等，校级挑战杯三等，学院电赛3等。无paper,推荐信是系里的教授和副教授，我们系只有一个教授。寒酸"
南加州大学,硕士,Asian Studies,录取,2017,4,110,,320,211 & 985,日语,93,,,,少年班出身。日本交换留学一年。半年Teaching assistant经历。无论文无实习。
伊利诺伊大学厄巴纳-香槟分校,硕士,Advertising,录取,2016,3,108,,320,211,广告学,88,,,,两个电视台实习/一个国际4A广告公司实习/一个世界500强市场部实习/有相关研究经历/小比赛若干 推荐信两个教授一个实习老板
埃默里大学,硕士,Law,录取,2015,3,106,,0,双非,法学,89,,,,论文发表两篇，模联积极参与者，有一个专利。
加州大学洛杉矶分校,硕士,Architecture,录取,2015,3,108,,322,211 & 985,建筑学（五年）,84,,,,
南加州大学,博士,Epidemiology,录取,2015,3,104,,323,211 & 985,,85.98,211 & 985,,,1篇灌水SCI
匹兹堡大学,博士,Chemistry,录取,2016,3,103,,321,,化学,84,,,,一篇挂名二作
伦敦大学学院,硕士,Landscape Architecture,录取,2015,0,,,0,211,园林,81,,,,
香港理工大学,硕士,Finance,录取,2014,0,,,0,双非,财务管理,81,,,,双非一本，两实习，一个是在地方财政局，另一个水实习，国家二级运动员，其他也木有什么了，可能面试进行的还不错~
德克萨斯农工大学,硕士,Landscape Architecture,录取,2015,2,94,,0,浙大/复旦/南大/南开/武大/华中科大/上海交大/天大,城市规划,87.38,,,,
哥伦比亚大学,硕士,"Urban, Community and Regional Planning",录取,2017,3,106,,333,,城市规划,88,,,,无论文，普通推荐，四份实习，三个会议，若干研究，两次海外交流，若干志愿者
康奈尔大学,硕士,Law,录取,2015,3,108,,0,211,法学,84,,,,
佐治亚大学,硕士,Landscape Architecture,录取,2017,2,99,,311,双非,风景园林,84,,,,
普渡大学,硕士,Computational Finance,录取,2015,2,94,,314,211,信息与计算科学,89,,,,"搜索公司工作两年半，会用点小统计模型，预测啥的
美赛一等奖等小奖若干，一作投了水sci（时间序列）刚被拒，需要再修改。

英语成绩是软肋。"
南加州大学,硕士,Teaching English to Speakers of Other Languages,录取,2017,3,105,,316,211,德英双语,88,,,,南加大最早申 现在才拿到
波士顿大学,硕士,Teaching English as a Second Language,录取,2016,3,102,,318,双非,英语教育,90,,,,有一个国家级的创新项目，无牛推，都是专业课老师跟我关系都很好而且很多交集！教育实习很多～参加过很多教学师范类的比赛，演讲比赛以及其他各种比赛～国内外教育志愿者经历～还有就是改了十多遍的文书！
香港理工大学,硕士,Chinese Culture,录取,2015,0,,,0,国外高校（含港澳台）,历史学,81,,,,三次学校优等学生，两个学校研究中心实习三个月经历，还有一些水水的内地博物馆、学校（一个月）实习。一封推荐信是副系主任，一封北大教授。若干小奖和发表文章。
康奈尔大学,硕士,Civil Engineering & Urban Planning & industrial design,录取,2013,0,,,335,国外高校（含港澳台）,土木工程,88,,,,
纽布伦斯威克大学,硕士,Computer Science,录取,2014,0,,,0,双非,信息管理与信息系统,77,,,,工作不到一年，两个IT实习，其它无。
香港浸会大学,硕士,Public Affairs,录取,2016,2,,6.5,0,,Media,87.8,,,,三个实习。一个国奖和 两个校奖
雪城大学,硕士,Advertising,录取,2015,3,103,,321,浙大/复旦/南大/南开/武大/华中科大/上海交大/天大,广告,84,,,,三个实习，一个4个月本土4A创意部实习，一个3个月JWT的客户部实习，1个水的CCTV 10频道的打杂实习，学校里边两个水的校级科研立项，一个广告比赛的小小奖，以及一些零零碎碎的小活动，小成果。推荐人是两个教授老师，一个国际4A的客户总监.
香港中文大学,硕士,Housing Studies,录取,2015,1,89,,0,211 & 985,sociology,85,,,,"6 years in non-profit
no GRE"
英属哥伦比亚大学,博士,Statistics,录取,2017,0,,,326,211,统计,87.88,,统计,,托福waive了。
代尔夫特理工大学,硕士,Computer Science,录取,2015,2,,6.5,0,211 & 985,软件工程,88.5,,,,"GPA 88.5
数学建模，校内奖学金，国家奖学金
水实习
大三GPA 1/190"
墨尔本大学,硕士,Accounting and Finance,录取,2015,3,,7,0,双非,会计,73,,,,2年校级1等奖学金 1个半年财务实习
代尔夫特理工大学,硕士,Embedded Electronic System,录取,2017,3,,7,0,211 & 985,自动化,80.16,,,,"无科研，无论文，水创新项目，大三专业课均分较高,两次国外短期交流经验，很多次志愿者证明，一个国家级志愿者证明。"
新加坡国立大学,博士,Mathematics,录取,2014,2,95,,325,浙大/复旦/南大/南开/武大/华中科大/上海交大/天大,数学,94,,,,
加州大学洛杉矶分校,硕士,Architecture,录取,2015,3,103,,318,双非,建筑学,84,,,,
宾夕法尼亚大学,硕士,Human Development,录取,2017,3,106,,325,211 & 985,应用心理学,88,,,,
纽约州立大学宾汉姆顿分校,硕士,Materials Engineering,录取,2016,1,84,,308,211,材料科学与工程,77,,,,
香港浸会大学,硕士,"Film, Television and New Media",录取,2015,3,,7,0,浙大/复旦/南大/南开/武大/华中科大/上海交大/天大,翻译,87,,,,"三年学生工作经历，学生组织负责人之一，，有台湾政治大学交换。
辅修过商科，大三上结束决定放弃，大三下定的去香港。【辅修科目成绩太低拖了不少平均分，所以辅修一定要慎重！！
从大三暑假才开始实习，所以实习经历并不多，其中一个是大电视台实习，直接跟的节目制片人，一个是一个新媒体项目，一个政府宣传片项目的制片助理。"
