AppliedSchool,Degree,Major,Result,Year,EnglishLevel,TOEFL,IELTS,GRE,School,SchoolMajor,GPA,Post_School,Post_Major,Post_GPA,Other_Info
北卡罗莱纳州立大学,硕士,Mechanical Engineering,录取,2015,2,97.0,,314,双非,机械设计制造及其自动化汽车工程,85.54,,,,
香港科技大学,硕士,Economics and Econometrics,录取,2015,4,110.0,,0,211,,88.0,,,,"四大行实习两个 一个政府部门实习
其他杂七杂八的课外活动很多 志愿者、给WHO官员翻译、学校创业项目成立外贸团购网站等等"
南洋理工大学,硕士,Precision Engineering,录取,2016,3,101.0,,0,浙大/复旦/南大/南开/武大/华中科大/上海交大/天大,测控技术与仪器,85.0,,,,一次米国暑假交流，一次CES参展，一个国家比赛一等奖，几个奖学金，无牛推，无项目
伦敦大学玛丽女王学院,硕士,Film Studies,录取,2016,0,,,0,211,广告学,87.0,,,,
香港理工大学,硕士,Bioengineering and Biomedical Engineering,录取,2014,0,,,0,浙大/复旦/南大/南开/武大/华中科大/上海交大/天大,生物科学（bioscience）,80.0,,,,一般的推荐
斯德哥尔摩大学,硕士,International and Comparative Education,录取,2016,2,,6.5,0,双非,师范英语,92.0,,,,"师范英语专业 瑞典交换一年 校奖很多 省重点高中优秀实习生 金鸡百花电影节志愿者外宾接待
有系主任和瑞典实习导师的推荐信
全国高师学生英语教师技能大赛二级一等奖...
我觉得最关键是在瑞典交换过一年吧 才低空飘过录取线~~~"
波士顿大学,硕士,International Relations and International Communication,录取,2015,3,105.0,,326,双非,国际政治,89.0,,,,国家奖学金，校级一等奖学金，水论文一篇，牛推（应该算）一个，科研项目若干。
华威大学,硕士,Educational Research,录取,2015,3,,7.0,0,,国际经济,86.0,,,,"4年英语教学经验。曾任RISE Teaching Supervisor,现为Wharton Teaching Director.
一位副教授，一位本科毕业论文导师推荐。
全国英语二级翻译证书（北外）。
国家四级育婴师，三级营养师。
钢琴演奏十级。"
加州大学洛杉矶分校,硕士,Architecture,录取,2015,3,100.0,,316,211 & 985,建筑学,87.0,,,,
香港城市大学,硕士,Applied Economics,录取,2016,2,,6.5,0,,社会学,84.0,,,,
伦敦大学学院,硕士,Digital Humanities,录取,2016,3,,7.0,0,211 & 985,汉语言文学,84.0,,,,申请不算早，过年放假的时候提交的。简历中规中矩，有两次实习一次交流，除此之外也没什么了。中间经过了一次电面，不过说是电面其实只是非正式聊天，聊了毕业论文主题、选择DH的原因、以后想干什么等等，觉得过程中自己说得不算多，更多时候是招生官在介绍课程...
哥本哈根大学,硕士,Pharmaceutical Sciences,录取,2015,3,104.0,,0,211 & 985,药学,84.0,,,,瑞典隆德大学交流一年
香港科技大学,硕士,Accounting,录取,2015,3,109.0,,0,浙大/复旦/南大/南开/武大/华中科大/上海交大/天大,金融学,89.3,,,,
伯明翰大学,硕士,"Critical Discourse, Culture and Communication",录取,2015,2,92.0,,0,211 & 985,汉语言文学,88.0,,,,"三封推荐信：导师、系主任、实习领导
两个实习：一省级电视台、一国内知名视频网站
台湾交换半年"
香港浸会大学,硕士,Media Management,录取,2015,2,,6.5,0,211 & 985,广告学,84.0,,,,经历拿过一些校级竞赛若干，一个省级竞赛优秀奖，各种三好先进，两年奖学金无论文，无特别抢眼的实习经历。不过我不去啦
利物浦大学,硕士,Finance,录取,2015,0,,,0,双非,金融,85.0,,,,
哥伦比亚大学,博士,Chemical Engineering,录取,2017,3,103.0,,329,清华/北大/中科大,化学工程,89.0,,,,明大的暑研，一篇二作paper在投
香港大学,硕士,Mechanical Engineering,录取,2016,3,105.0,,317,清华/北大/中科大,,81.0,,,,
加州大学伯克利分校,博士,History,录取,2015,4,115.0,,329,国外高校（含港澳台）,非历史非东亚,89.0,国外高校（含港澳台）,2nd = history,,"一篇半book review（英文版一篇，威力加强版中文）；
两篇水文……"
台湾大学,硕士,Economics,录取,2017,3,108.0,,324,双非,经济学,84.0,,,,
香港理工大学,硕士,Operation Research,录取,2014,0,,,0,双非,金融工程,84.0,,,,水论文一篇于省级刊物。水实习1个。国奖都没拿过。
香港中文大学,硕士,Marketing,录取,2017,3,,7.0,0,双非,会展经济与管理,88.0,,,,楼主没什么特别的实习经验什么，都有点水的。奖学金每学期都有的
建筑联盟学院,硕士,Landscape Urbanism,录取,2015,0,,,0,国外高校（含港澳台）,建筑学,86.0,,,,"目前英国利物浦大学建筑系本科在读Final year.

本科是西交利物浦大学建筑系2+2到英国利物浦大学，拿的是英国本科文凭 BA of Architecture 并且还有RIBA PartI，拿到的都是conditional offer，巴斯要求雅思7.0， 其他的也都是要求我能拿到60分以上（upper second class）顺利毕业就好了（UCL 只要了50分 lower second class）。

自学了平面设计的一些理论和软件，有平面设计的工作经验（杂志美编，公司品牌宣传 名片设计等等）纯属本人对设计类相关专业的爱好啦。

目前为止还没有考过雅思。"
香港科技大学,硕士,Teaching Chinese as a Second Language,录取,2014,0,,,0,浙大/复旦/南大/南开/武大/华中科大/上海交大/天大,,86.2,,,,北京教育科学研究院实习 支教 汉办HSK命题员 专业实习（大部分时间都给老师做TA了） 银行实习 韩国半年带奖交换，交换成绩3.72/4.3，期间给一位澳籍教授做项目，并拿到了教授的推荐信（教授亲自写的） 系主任推荐信一封 校内教授推荐信一封 各种奖学金和社团实践
西北大学,硕士,Journalism,录取,2017,4,113.0,,330,,英语,84.0,,,,
乔治城大学,硕士,"Communication, Culture and Technology",录取,2016,3,104.0,,322,211,国际商务,81.0,,,,实习有一个DELL的市场部实习，一个CRI的实习，别的也没什么值得拿出来的经历。推荐信两封分别来自CRI和CNR的前辈，一封来自学校的老师，不是牛推。
范德堡大学,硕士,American Law,录取,2017,3,,7.0,0,211,法学,86.0,211,法学,AA,中上内所实习三个月，北京市司法局实习三个月，检察院实习一个月，两次志愿者经历，拿过一奖三奖
伊利诺伊大学厄巴纳-香槟分校,硕士,Law,录取,2015,3,103.0,,0,双非,法学,84.0,,,,二本院校毕业，本科期间一段欧洲交流经历，两段实习经历，一份律所，一份银行，但都不是大牛；比赛获奖若干，校级奖学金两次。无论文，无项目。毕业后两段工作经历，前一份和法律没太大关系。总之感觉自己的经历其实没有什么亮点。
密歇根大学安娜堡分校,硕士,Architecture,录取,2017,0,,,321,,建筑学,86.41,,,,
丹麦技术大学,硕士,Digital Media Engineering,录取,2015,4,,7.5,326,211 & 985,通信工程,86.0,,,,爱党爱人民
诺丁汉大学,硕士,Marketing,录取,2015,4,,7.5,0,,商务英语,84.0,,,,
纽约大学,硕士,Teaching English as a Second Language,录取,2015,3,102.0,,317,双非,汉语言文学,90.0,,,,有论文发表，在美国交换一个学期，推荐人两位为交换学校的老师，一位是本校班主任，一位是实习的小学校长。四段实习经历，获奖若干~
哥伦比亚大学,硕士,Economics and Econometrics,录取,2017,3,102.0,,322,浙大/复旦/南大/南开/武大/华中科大/上海交大/天大,电气工程,88.0,,,,
谢菲尔德大学,硕士,Global Journalism,录取,2014,0,,,0,双非,涉外翻译,88.0,,,,第四届亚太批发市场大会翻译，泰国举办的东盟青年营的中国代表。广播台干部，校内活动一堆
谢菲尔德大学,硕士,Creative and Cultural Industries Management,录取,2017,2,,6.5,0,211 & 985,民族学,87.3,,,,台湾交换半年，均分90。专业对口单位实习一份
华威大学,硕士,Economics,录取,2017,2,,6.5,331,211 & 985,工业工程,87.0,,,,
内布拉斯加大学医学中心,博士,Pharmaceutical Sciences,录取,2015,1,89.0,,318,211,基础药学理科基地班,84.0,211,药物化学,81,专利一篇，推荐信均来自自己学校老师。
香港中文大学,硕士,Religious Studies,录取,2015,2,,6.5,0,双非,汉语言文学,83.1,,,,"又拿到两个offer，好开心~感恩激动之情溢于言表~~背景双非啊双非，中大居然要我了！！背景一般的孩纸们一定要坚定信心啊！！！
没什么特长的，很普通的一个人。校级奖学金三个。一个实习。两个国奖。也许是ps写得比较动人~~(??????)??
决定放弃BU了，但是依然很看好BU的未来和实力。本来今天决定要接受BU的offer了，下午突然接到中大的offer欣喜若狂~
希望大家都能心想事成，梦想成真~！！"
香港科技大学,硕士,Financial Analysis,录取,2015,3,,7.0,0,211,经济学数学双学位,88.0,,,,
隆德大学,硕士,Welfare Policies and Management,录取,2014,0,,,0,双非,Labor and Social Security,85.0,,,,"推荐信三篇，都自己写的，老师和领导签字（据说学校也不看）
实习两段，政府机关，都不超过一个月（实际上就是暑假去玩儿了几天）
NGO工作经历一段（其实就是挂名而已）
奖学金都是校奖，其他也没有有分量的获奖经历，都是些学校内的乱糟糟的活动。"
香港城市大学,硕士,"Linguistics, Interpretation and Translation",录取,2014,0,,,0,双非,商务英语,88.0,,,,无牛推 无论文 专四 六级 三次国家奖学金 众多的活动比赛奖项 两个志愿者经历 1个寒假的培训机构教育实习
爱丁堡大学,硕士,Electrical and Electronics Engineering,录取,2016,2,,6.5,0,211 & 985,电气工程及其自动化,81.0,,,,奖学金四次，三个水水的专利
路易斯安那州立大学,硕士,Mechanical Engineering,录取,2015,2,90.0,,317,211,过程装备与控制,86.33,,,,"两篇SCI  一篇三作一篇五作 一篇中文一作在投，很久没消息，估计fail 一个专利一作 若干国家奖励，若干校级奖励

学校很普通 背景很一般，被拒了很多，情人节一个，大年三十一个 初一一个，元宵一个"
南加州大学,硕士,Public Policy Analysis,录取,2015,3,107.0,,326,211,,85.66,,,,本科和申请专业不是绝对相关，可能是被拒的一部分原因吧
香港城市大学,硕士,Electrical and Electronics Engineering,录取,2015,4,,7.5,0,双非,电磁场与无线技术,89.1,,,,一篇水论文三作，可忽略不计
路易斯安那州立大学,博士,Chemistry,录取,2015,1,89.0,,322,,material chemistry,82.0,211,physical chemistry',84,申请时无论文 无牛推
北卡罗来纳大学教堂山分校,博士,Computer Science,录取,2015,3,,7.0,320,211 & 985,计算机科学,89.0,,,,"两篇水论文。。还有一些水竞赛奖项。。奖学金就是国奖，一等什么的咯。。
信里说系里以后评奖。。我感觉是没有的。。。==|"
罗彻斯特大学,硕士,Bioengineering and Biomedical Engineering,录取,2017,3,108.0,,324,浙大/复旦/南大/南开/武大/华中科大/上海交大/天大,声学,88.0,,,,ncsu暑研，海外ap推荐信一封，一篇apl二作，一篇国际会议poster一作，一篇oral挂名。
康奈尔大学,硕士,Civil Engineering & Urban Planning & industrial design,录取,2013,0,,,335,国外高校（含港澳台）,土木工程,88.0,,,,
香港理工大学,硕士,Chinese Culture,录取,2016,0,,6.0,0,双非,汉语言文学,84.0,双非,,,
罗德岛设计学院,硕士,Architecture,录取,2015,2,102.0,6.5,326,211,建筑,84.0,清华/北大/中科大,,,
南卡罗来纳大学,博士,Biology and Biological Science,录取,2015,3,108.0,,318,双非,生物科学（师范类）,84.0,国外高校（含港澳台）,环境生物技术,92,一作土鳖国内期刊两篇，3作一篇正在投稿，5作一篇(7分），Acknowlegement带名字一篇8分
马萨诸塞大学安姆斯特分校,博士,Electrical and Electronics Engineering,录取,2015,2,90.0,,317,211,自动化,90.0,211 & 985,控制科学与工程,,无牛推，无Paper，5年相关工作经验，套磁较多，有多个面试
卡内基梅隆大学,硕士,Materials Science,录取,2014,3,106.0,,325,双非,,89.0,,,,台大实验室交换经历+一大推国内外交流经历，台湾+日本教授推荐信，3篇水文论（其中两篇排名很后），院学生会主席等。
卡尔加里大学,硕士,Mechanical Engineering,录取,2014,2,98.0,6.0,0,浙大/复旦/南大/南开/武大/华中科大/上海交大/天大,测控技术与仪器,84.0,,,,无牛推，无论文，套磁是王道！
香港浸会大学,硕士,Ethics,录取,2015,0,,6.0,0,双非,英语,81.9,,,,
圣路易斯华盛顿大学,硕士,Project Management,录取,2014,2,97.0,,309,双非,电气工程及其自动化/工程造价,85.0,,,,
阿尔伯塔大学,硕士,Educational Policy Studies,录取,2014,0,,,0,国外高校（含港澳台）,英文專業,84.0,,,,"我是港澳台高校啦……不是國外本科
我申请course-based,所以没有套磁
大三美國交換一學期
大二香港大学暑期交流
請了一個在美國交換時的教授寫推薦信 （寫得很好很具體..）
大三大四的時候，GPA有3.5+  （p.s 這學期大學畢業）"
纽约州立大学布法罗分校,博士,Chemical Engineering,录取,2015,3,101.0,,330,浙大/复旦/南大/南开/武大/华中科大/上海交大/天大,化工,84.0,浙大/复旦/南大/南开/武大/华中科大/上海交大/天大,化学,88,SCI一区二三作各一篇。
莱顿大学,硕士,Computer Science,录取,2016,3,,7.0,0,清华/北大/中科大,,84.0,,,,"不相干实习两个
水会议一篇"
香港理工大学,硕士,Other,录取,2013,0,,,0,双非,化学,75.0,,,,2年工作经验
德克萨斯大学阿灵顿分校,博士,Computer Science,录取,2016,2,91.0,,0,211 & 985,,87.78,,,,项目有两个水的，竞赛基本没参加过。一、二、三等奖学金和国家奖学金都拿过的。小本哦，没读研。
德克萨斯大学达拉斯分校,硕士,Industrial Engineering,录取,2016,4,113.0,,316,,化学工程,81.0,,,,"在美国实习了两个夏天＋coop一个学期
在学校做过research 无paper"
香港城市大学,硕士,Asian and International Studies,录取,2016,4,,7.5,0,双非,德语,81.0,,,,德国交换一年，无牛推无发表，几次模联经历，几个水实习。
密歇根理工大学,博士,Mechanical Engineering,录取,2015,3,100.0,,322,,,87.0,,,,3个4th，IF还行
威斯康星大学,硕士,Curriculum,录取,2015,3,104.0,,330,浙大/复旦/南大/南开/武大/华中科大/上海交大/天大,经济类,84.0,,无,,无实习，无交流
香港浸会大学,硕士,Translation and Bilingual Communication,录取,2014,0,,,0,双非,英语,88.6,,,,无论文无牛推，一个国奖，三次校甲等奖学金，两次省翻译大赛口译一等奖，一堆辩论赛奖项，培训机构兼职老师实习。
香港中文大学,硕士,Accountancy,录取,2016,3,,7.0,0,211 & 985,金融,89.0,,,,
伦敦大学学院,硕士,English Language Studies,录取,2015,4,,7.5,0,双非,英语,87.2,,,,
卡尔加里大学,硕士,Mathematics,录取,2015,4,,7.5,0,211,数学与经济学双学位,87.0,,,,"MCM H奖 + 国赛省一 + 两个实习 + 水科研三个 + 无paper
211财经大学，数学类课程在89左右，金融经济类课程在90左右
Funding：$23,266.94 per year"
香港城市大学,硕士,Integrated Marketing Communications,录取,2016,3,,7.0,0,211 & 985,国际政治,90.0,,,,"辅修：公共关系
项目：大学生创新训练项目国家级立项；校级调研2个
实习：报社实习；国际4A广告公司，PR Intern
交换：韩国，一个学期
奖学金：单项奖学金（学术型）"
香港中文大学,硕士,Intercultural Studies,录取,2016,2,,6.5,0,双非,,85.28,,,,
罗彻斯特大学,硕士,Electrical and Electronics Engineering,录取,2015,2,98.0,,321,浙大/复旦/南大/南开/武大/华中科大/上海交大/天大,光电子材料与器件,84.0,,,,
欧盟奖学金项目,硕士,Tropical Biodiversity and Ecosystems,录取,2016,2,,6.5,0,浙大/复旦/南大/南开/武大/华中科大/上海交大/天大,生物学,85.13,,,,没文章没牛推 大二开始实习 小奖几个没啥用 基本是啥都没有……
香港理工大学,硕士,Electrical Engineering Technician,录取,2014,0,,,0,双非,电气,84.0,,,,"无论文，正常申请，本科排名一般，百分之10,简直就是水"
香港城市大学,硕士,Chinese,录取,2015,3,,7.0,0,浙大/复旦/南大/南开/武大/华中科大/上海交大/天大,汉语言文学,86.0,,,,无论文，推荐人是副院长和某教研室主任，省级电视台和省级报社实习，几个文化相关的社会实践，学生会部长，奖学金和一些校级小奖
林肯大学,硕士,Interior Architecture,录取,2017,2,,6.5,0,211,建筑学,84.0,,,,
欧洲创新与技术研究院,硕士,Digital Media Technology,录取,2015,3,,7.0,0,211 & 985,电子信息工程,86.4,,,,无牛推，水科研，无论文，其他乱七八糟的奖项估计也没啥大用(或许EIT会感兴趣。。)
欧洲创新与技术研究院,硕士,Digital Media Tenchnology,录取,2016,2,,6.5,0,211 & 985,通信工程,85.51,,,,一个半年相关工作经历，一个三个月在中国移动的实习。
香港大学,博士,Economics,录取,2016,3,102.0,,323,浙大/复旦/南大/南开/武大/华中科大/上海交大/天大,人文类,87.5,清华/北大/中科大,人文专业,85.4,学校背景还不错，其他真的很蹩脚。
佐治亚大学,博士,Mechanical Engineering,录取,2015,2,90.0,,321,211 & 985,工程力学,84.0,211 & 985,计算力学,90,有学院的老师推荐给他相熟的同学
英属哥伦比亚大学,本科,Computer Science,录取,2016,3,,7.0,0,211,电子信息工程,94.0,,,,专利一个，校级国家级奖学金若干，无科研
范德堡大学,硕士,General Law,录取,2017,3,100.0,,0,双非,民商法,84.0,,,,"帝都小公务员一枚,司法局工作两年，在家人鼓励下辞职准备读研，我有一个帅气的老妈^^"
香港大学,硕士,Curriculum,录取,2016,4,,7.5,0,,英语专业,87.72,,,,奖学金两次，无牛推，无论文，无科研
香港城市大学,硕士,Integrated Marketing Communications,录取,2015,2,,6.5,0,211 & 985,哲学,81.0,,,,
西北大学,硕士,Environmental Engineering,录取,2016,3,106.0,,326,浙大/复旦/南大/南开/武大/华中科大/上海交大/天大,环境科学,84.0,,,,
北卡罗来纳大学教堂山分校,硕士,Mental Health Counseling,录取,2016,2,97.0,,0,211 & 985,工商管理类,81.0,,,,
香港理工大学,硕士,Translating and Interpreting,录取,2016,4,,7.5,0,双非,英语师范,89.0,,,,
纽约大学,硕士,Public Relations and Cooperate Communication,录取,2016,3,101.0,,325,211,英语,88.0,,,,
谢菲尔德大学,硕士,Finance,录取,2015,0,,,0,双非,金融,85.0,,,,
南加州大学,硕士,Landscape Architecture,录取,2017,0,,,0,211 & 985,风景园林,88.0,,,,
佐治亚大学,硕士,Biostatistics,录取,2017,3,,7.0,321,211,生物工程,84.0,,,,
哥伦比亚大学,硕士,Public Administration,录取,2017,3,107.0,7.0,314,双非,Spanish,88.0,,,,
苏黎世联邦理工学院,硕士,Computational Biology,录取,2016,3,,7.0,318,,生物医学工程,90.59,,,,
布朗大学,博士,Chemistry,录取,2017,3,101.0,,322,,物化,84.0,,,,
新加坡国立大学,博士,Computer Science,录取,2015,2,,6.5,0,211 & 985,软件工程,93.0,,,,若干国奖，国家级奖学金。去NUS学习过40多天，和教授成为了好朋友
香港科技大学,硕士,Intelligent Building Technology and Management,录取,2017,2,,6.5,0,,机械设计制造及其自动化,84.5,,,,每年都有奖学金，没有科研，一份实习
香港中文大学,硕士,Journalism,录取,2014,0,,,0,双非,,90.0,,,,"推荐：实习老师推荐+论文导师推荐
实习：两个国内媒体（网媒/电视）+校记者团
其他：语言类比赛奖项若干，志愿活动若干
寄送材料附加了作品集"
圣加仑大学,硕士,Economics,录取,2016,3,,7.0,319,,应用经济学,81.0,,Mathematics,81,
弗吉尼亚理工,硕士,Architecture,录取,2015,3,103.0,,320,浙大/复旦/南大/南开/武大/华中科大/上海交大/天大,建筑,84.32,,,,
香港城市大学,硕士,Marketing,录取,2015,3,,7.0,0,双非,市场营销,84.0,,,,
密歇根州立大学,博士,Chemistry,录取,2017,3,,7.0,319,211 & 985,化学,92.0,,,,无论文  三段实验室经历 国奖校奖若干 美国交流一年 GPA4.0 三封外导推荐信  美加混申均未套瓷
伊利诺伊大学厄巴纳-香槟分校,硕士,Policy Economics,录取,2016,4,,7.5,320,,应用经济学,84.0,,,,"美国暑期实习一份
全奖入学"
纽约市立大学巴鲁克学院,硕士,Public Administration,录取,2015,0,,,309,国外高校（含港澳台）,psychology,81.0,,,,因为本科在美国毕业的，没有考T。在美国一个non-profit全职工作过1年多，加上暑假实习3个月，还有各类fellowships的经验。因为工作签证被拒的关系申请了MPA，当时准备匆忙加上搬家，G只准备了2个月左右，是硬伤，所以申请的学校比较广。老板的推荐信比较牛，但是不太方便透露他的职位。
香港中文大学,硕士,New Media,录取,2016,3,,7.0,0,211,广播电视新闻,88.0,,,,两段传媒实习，一段是纸媒，一段是在新媒体部门，还有一段公益传播的经历。三年都有学校的奖学金，拿过一个广告比赛的奖，几段志愿者经历。台湾交换生。没有论文。
范德堡大学,硕士,International Education Policy and Management,录取,2015,3,106.0,,320,双非,对外汉语,88.0,,,,
博科尼大学,硕士,Economics and Econometrics,录取,2015,2,96.0,,317,浙大/复旦/南大/南开/武大/华中科大/上海交大/天大,经济,87.0,,,,硬件各种渣，其他背景定位贴里有，不会删的。
东英吉利大学,硕士,Film Television and Creative Pratice,录取,2015,2,,6.5,0,211 & 985,广播电视新闻学,88.0,,,,省级电视台实习；影视作品和文字作品较多，获奖多（1个国际奖，多个国家奖）；学校奖学金每学期都有拿。
伦敦大学亚非学院,硕士,International Politics,录取,2017,3,108.0,,0,211 & 985,外国语文学,88.0,,,,拿到过小奖，西班牙交换过，跨专业申请因而没什么学术成果，有一定的基础知识。
香港科技大学,硕士,Engineering Enterprise Management,录取,2016,2,,6.5,0,211,油气储运工程,85.0,,,,
罗格斯大学,博士,Mechanical Engineering,录取,2015,2,90.0,,317,211,过程装备与控制,86.33,,,,"两篇SCI  一篇三作一篇五作 一篇中文一作在投，很久没消息，估计fail 一个专利一作 若干国家奖励，若干校级奖励

学校很普通 背景很一般，被拒了很多，情人节一个，大年三十一个 初一一个，元宵一个"
香港理工大学,硕士,Software Technology,录取,2015,2,97.0,,0,211,电气工程,81.0,,,,奖学金若干，水项目若干，相关工作经验一年，无牛推
香港大学,硕士,Computer Science,录取,2014,2,,6.5,0,双非,通信工程,81.0,,,,211 三个水实习 无论文无牛推
密苏里大学,博士,Mechanical Engineering,录取,2015,2,97.0,6.5,320,211 & 985,车辆和电气双学位,87.0,211 & 985,车辆,87,无牛推，有论文有项目
波恩大学,硕士,Mathematics,录取,2017,2,92.0,,322,211 & 985,数学,86.7,,,,
香港城市大学,硕士,Economics,录取,2013,2,95.0,,0,双非,贸易经济,84.0,,,,工作经验一年，水实习一个 奥运会志愿者算不算 奖学金若干，没有任何论文背景
芝加哥大学,硕士,Social Science,录取,2017,3,105.0,,324,浙大/复旦/南大/南开/武大/华中科大/上海交大/天大,major in 经济学 minor in 数学与应用数学,89.0,,,,三封推荐信，全强推，无牛推。班导兼中微老师，强调了学术学习能力、学术潜力、组织与合作能力和明确的学术职业规划；科研导师，强调了学术搜索、整理和英文写作能力、强烈的学术兴趣、交叉学科学习背景；计算数学系授课老师，强调了数学基础、计算机编程能力、持续学习数学和计算机课程的motivation和规划。
明尼苏达大学双城分校,硕士,Biostatistics,录取,2017,3,101.0,,323,211 & 985,基础医学,84.0,,,,无论文，一个省级奖，接近三年医学科研经历，现在在做一个跟数据和机器学习相关的毕设。
伊利诺伊大学厄巴纳-香槟分校,硕士,Law,录取,2015,1,82.0,,0,双非,法学,85.0,,,,已经毕业一年了 内所工作一年 学校课外活动比较多 在校期间三年二等奖 还有法院实习 GPA没刷 托福也比较弱。。。。
