AppliedSchool,Degree,Major,Result,Year,EnglishLevel,TOEFL,IELTS,GRE,School,SchoolMajor,GPA,Post_School,Post_Major,Post_GPA,Other_Info
香港中文大学,硕士,Chinese Linguistic and Language Acquisition,录取,2015,3,,7.0,0,双非,对外汉语,85.0,,,,连续4年得学院奖学金；一年半印尼汉语教师志愿者经历。
西蒙弗雷泽大学,硕士,Chemistry,录取,2015,4,,7.5,0,国外高校（含港澳台）,化学,88.0,,,,dean list，香港化学奥林匹克之类的水奖，无论文。
康奈尔大学,硕士,Architecture,录取,2015,3,100.0,,320,211 & 985,建筑学,88.0,,,,
德克萨斯大学奥斯汀分校,硕士,Statistics,录取,2013,0,,,332,国外高校（含港澳台）,精算学,88.0,,,,无论文，只有几个project和专业相关实习，大概本校录取会容易一点吧。
悉尼大学,硕士,Architectural Sciences and Technology,录取,2016,0,,,0,211 & 985,建筑环境与设备工程,81.0,,,,有奖学金、社团活动、学术、实习等经历 但是申请澳洲的时候都没提交 或者说不需要提交。。。
西蒙弗雷泽大学,硕士,Economics and Econometrics,录取,2015,0,,,322,211 & 985,统计,84.0,国外高校（含港澳台）,统计,80,"中文论文*3 英文一篇退回修改中
省级项目一个 
现从事银行数据分析工作
想不出还有什么要说的了"
香港中文大学,博士,Atmospheric Sciences,录取,2014,2,95.0,,320,清华/北大/中科大,环境科学,80.0,,,,"一封本科导师的推荐信，一封哈佛“牛推”。
论文一篇在写，没有发表的。"
香港城市大学,硕士,Communication and New Media,录取,2016,3,,7.0,0,浙大/复旦/南大/南开/武大/华中科大/上海交大/天大,,84.0,,,,两个相关实习，其中一个省级电视台；一个科研，得小奖；一个校级实践。
匹兹堡大学,硕士,Telecommunication Technician,录取,2015,3,101.0,,314,211 & 985,telecommunications,84.0,,telecommunications,,"无牛推，无论文，无大项目的三无小渣。。。
有大创项目，有TI小奖，课设小项目。。。总之背景一般"
伯明翰大学,硕士,International Accounting and Finance,录取,2017,0,,,0,211,会计学,84.5,,,,无雅思申请，两篇水论文，大型国企财务工作一年 专业课成绩基本都是90+
香港城市大学,硕士,Business Information Systems,录取,2017,2,,6.5,0,211,电气工程,84.0,,,,
圣路易斯华盛顿大学,硕士,Law,录取,2017,0,,,0,双非,法学,84.0,,,,托福不到100
滑铁卢大学,硕士,Computer Science and Computer Engineering,录取,2013,0,,,327,国外高校（含港澳台）,计算机科学,92.0,,,,有做程序员的工作经验
波士顿大学,硕士,Mass Communication,录取,2016,4,116.0,,328,211,英语语言文学,88.0,,,,3封推荐信，一封是学校老师的，两封是两份实习领导给写的；拿过校一等奖学金、二等和小奖各一次，在学生会院外联部做到了部长，大一大二全身心投入学生工作，大三下才开始实习...在CCTV打过酱油，爱德曼（公关公司）三个月，万博宣伟（公关公司）三个月。经历很少，但是个人陈述里使劲拓展~
普渡大学,硕士,Civil Engineering,录取,2016,3,106.0,,315,211,测绘工程,81.0,,,,一篇一作国家核心论文，但申请时并没有拿到录用，只是写成了研究经历。
密歇根大学安娜堡分校,博士,Communication Studies,录取,2016,4,,7.5,320,浙大/复旦/南大/南开/武大/华中科大/上海交大/天大,管理,86.0,,Political Communication,,
圣路易斯华盛顿大学,博士,East Asian Languages and Literatures,录取,2015,0,,,330,,亚洲研究,88.0,国外高校（含港澳台）,日本研究,88,"一个regional conference best paper。GRE是几年前考的，没重考，虽然aw分数低的没法看，不过好像也没什么影响？现在还有几个学校现在还没消息（harvard, chicago）估计都炮灰了。基本上想在umich, ucla和princeton里面选，想听听大家意见！"
香港理工大学,硕士,Social Policy and Social Development,录取,2016,2,,6.5,0,双非,社会工作,84.0,,,,
乔治城大学,硕士,Law,录取,2015,3,106.0,,0,211 & 985,英语  法学(二学位）,85.0,,,,英语语专业本科，二学位选俢法学，在金杜所两次实习共计近五个月，在北京一普通所实习两个月，在中国劳动保障报和黑龙江法制报各发表一篇关于农民工讨薪和普法教育方面的文章，有金杜合伙人丶法学院副教授和外院院长的三封推荐信。
香港科技大学,硕士,Civil and Environmental Engineering,录取,2015,4,,7.5,0,浙大/复旦/南大/南开/武大/华中科大/上海交大/天大,环境工程,84.0,,,,
宾夕法尼亚州立大学,硕士,Teaching English as a Second Language,录取,2015,3,104.0,,317,,英语教育,84.0,,,,拿过奖学金，参加交换，各种艺术活动，教育相关实习2-3个，有志愿者活动
鲁汶大学,硕士,Electrical and Electronics Engineering,录取,2015,4,116.0,,325,211,集成电路,92.0,,,,水科研水推荐信 一个挂名paper两个挂名专利
曼彻斯特大学,硕士,Educational Administration,录取,2015,0,,6.0,0,双非,汉语言文学,83.0,,,,
莱斯大学,硕士,Materials Science,录取,2015,3,102.0,,333,211 & 985,高分子材料与工程,87.0,,,,SCI论文两篇，一篇二作一篇三作。
香港城市大学,硕士,Law,录取,2015,3,101.0,,0,双非,法学（国际经济法）,84.0,,,,从来没有拿过奖学金的人，绩点一般；参加过两届Jessup，组织过学校的模拟法庭，担任过学生干部，然后2014年暑假去了欧洲参加一个Summer School；过司考。
犹他大学,博士,Metallurgical Engineering,录取,2015,1,85.0,,322,211 & 985,冶金工程,91.3,,,,国家级创新训练项目—“能源材料方向”（负责人）；全国节能减排大赛—“湿法冶金方向” (一等奖)；SCI论文2篇（3作），n作水专利1项。
波士顿大学,硕士,Economics Policy,录取,2017,4,,7.5,323,国外高校（含港澳台）,经济学,88.0,,,,"LSE M&S; con2:1学位。
UCL con一等学位。
其他全部con2:1。"
圣路易斯华盛顿大学,硕士,Law,录取,2015,3,105.0,,0,211 & 985,法学,84.0,,,,经历无亮点：两个内所实习，一个公司法务实习，推荐信一封教了好几门课的老师、一封学年论文+毕业论文导师、一封实习所的高级合伙人，杂七杂八的社团活动，也没有什么有分量的奖，也没做过项目……
密歇根大学,硕士,Civil Engineering & Urban Planning & industrial design,录取,2013,0,,,335,国外高校（含港澳台）,土木工程,88.0,,,,无牛推，自己写的PS
普瑞特艺术学院,硕士,Interior Design,录取,2015,2,96.0,,312,浙大/复旦/南大/南开/武大/华中科大/上海交大/天大,材料科学与工程,80.5,,,,
弗吉尼亚大学,硕士,Educational Psychology,录取,2016,3,101.0,,319,211 & 985,心理学,84.0,,,,
乔治华盛顿大学,博士,Economics and Econometrics,录取,2016,3,107.0,,320,,国际经济与贸易,88.0,,,,本科生。两篇合作发表（个人觉得比较水的），其他荣誉较多，有一段海外志愿者经历，一份实习。
香港中文大学,硕士,Advertising,录取,2015,3,,7.0,0,浙大/复旦/南大/南开/武大/华中科大/上海交大/天大,计算机科学与技术&广告学,84.0,,,,"四个实习：电视台广告中心&互联网市场岗&咨询公司公关岗&银行
校级省级若干广告营销相关奖项，活动若干，主席团，志愿者经历
校园创业
台湾短期交流项目
无论文 推荐信两个教授"
香港大学,博士,Medicine & Pharm & Nutrition Science,录取,2013,0,,,0,清华/北大/中科大,public health,88.0,清华/北大/中科大,public health,85,一作2篇，二作2篇
麦吉尔大学,硕士,Biostatistics,录取,2014,0,,,0,国外高校（含港澳台）,Statistics+Minor Math,88.0,,,,
乔治城大学,硕士,Analytics,录取,2015,2,99.0,,320,211,,86.43,,,,4Y WE
香港理工大学,硕士,China Business Studies,录取,2014,0,,,0,双非,国际经济与贸易,84.0,,,,
香港中文大学,博士,Microbiology,录取,2015,1,89.0,,0,浙大/复旦/南大/南开/武大/华中科大/上海交大/天大,预防医学,80.0,,,,本科毕业直接申请，本科就最后一年拿过三等奖学金，校优秀毕业论文，一作一篇PloS One（3.73分），与申请专业无关。
范德堡大学,硕士,Law,录取,2017,3,100.0,,0,211,法学,84.0,,,,基层法院，省检察院，现top内所实习，法律援助及诊所
南洋理工大学,博士,Electrical and Electronics Engineering,录取,2015,2,98.0,,316,211,通信工程,84.0,,,,参加过很多小项目和几个比赛，有一堆奖学金证书等。但是没有论文、英语低分很拉后腿，，不过NTU申请还是很顺利的。
香港城市大学,硕士,Electronic Business and Knowledge Management,录取,2016,2,,6.5,0,211,市场营销,85.81,,,,"学校学生活动丰富，2个summerschool,3个实习"
宾夕法尼亚州立大学,硕士,Teaching English as a Second Language,录取,2015,4,,8.0,321,211,英语系,84.0,,,,
范德堡大学,硕士,Law,录取,2016,3,104.0,,0,双非,法学,85.0,,,,发表论文一篇，三个实习经历（法院，小所，top所），法律援助服务，法律诊所
利兹大学,硕士,New Media,录取,2017,3,,7.0,0,211 & 985,新闻学,83.2,,,,"大报社和省级电视台实习，不水。UCI 夏校。本科期间无奖学金、论文、项目。推荐信的话，其中一位本校老师是英国威敏毕业的，和浸会的老师们熟。还有一位是实习单位的上司。

走的上海某中介申请，文书老师不算多优秀，但是基本水平也是有的，而且很负责不拖拉，沟通也很愉快。感觉找中介确实省事，但是有风险，关键还得看帮你做材料的老师到底怎样。如果自己不怕麻烦英语也过关的话，香港申请建议还是DIY吧。如果像我一样怕麻烦又碰上好老师，找中介蛮好。"
杜克大学,硕士,Engineering Management,录取,2016,3,105.0,,324,清华/北大/中科大,建设管理,84.38,,,,
约克大学(英国),硕士,Teaching English as a Second Language,录取,2016,2,,6.5,0,双非,对外汉语,80.68,,,,"某东方和xx雅思的实习两份，都是雅思助教时间为一个多月
某汉语机构的实习当老师是一个多月
然后演讲比赛什么的大大小小的奖项
社团和学生会工作有一点。。。"
香港浸会大学,硕士,"Chinese Literature, Language & Culture",录取,2017,2,,6.5,0,211,汉语言文学,84.0,,,,有几篇刊登省级刊物的论文，两段实习经验，学校中学语文教研室编教材经历和若干志愿服务、几项写作和专业奖项。
佐治亚大学,硕士,Artificial Intelligence,录取,2014,3,102.0,,325,双非,自动化,87.4,,,,"无牛腿/水文二作一篇/水文二作被拒一篇 - -
挺久之前得到的 说二月份讨论funding 到现在还没出结果o(╯□╰)o"
南洋理工大学,硕士,International Political and Economy,录取,2014,0,,,0,双非,英语,80.0,,,,211&985，由于申请了不同的专业，推荐信多准备了一份，3个老师的推荐信，本专业及辅修专业，还有一个国大校友的推荐信，辅修专业金融，实习三个，银行，新闻网站编辑及政府机关实习。校内还有一些活动。
麦吉尔大学,硕士,Second Language Education,录取,2015,2,97.0,,0,双非,对外汉语,84.0,,,,无文无推，学校专业还是比较受认可的吧。有点工作经验，而且今年申请的人可能比较少，一直感觉macgill还是挺学术的。。。学术渣本来不太报希望的
伦敦大学学院,硕士,Civil Engineering,录取,2015,3,,7.0,0,211 & 985,港口航道与海岸工程,83.0,,,,"1. 科研项目3个，一个是大学生创新，还有的是跟着教授做实验，很感谢大学期间教俺的某位教授，人品和学术水平都是棒棒哒！！
2. 有一段工作经历，所在单位还算踉踉跄跄挤进世界500强~~~"
新南威尔士大学,硕士,Electrical Engineering,录取,2015,0,,6.0,0,211 & 985,集成电路设计与集成系统,84.0,,,,加权大概84.68，然后发过一篇很水的论文。然后也没有什么特别的，自己DIY的。感觉条件还是很普通的。港科，还有澳洲三所学校的具体通知时间我忘了就按我写的月份算吧。港大写的时间是拿到con offer那一天。南洋理工是偏方出的那天。新加坡国立是写的状态offer made的这一天。
香港大学,博士,Electrical and Electronics Engineering,录取,2015,0,,6.0,0,211 & 985,电子信息工程,84.0,,电子与通信工程,88,"2篇国际期刊SCI（一作）,2篇国际会议EI/ISTP(一作)，1篇国际会议EI/ISTP(三作)。国奖。"
宾夕法尼亚大学,硕士,"Urban, Community and Regional Planning",录取,2015,3,109.0,,320,211 & 985,城市规划,84.0,,,,三篇收录学术论文，其他都是自己的设计作业啦课程论文啦巴拉巴拉
香港城市大学,硕士,Chinese,录取,2015,3,,7.0,0,211 & 985,汉语言文学,83.6,,,,"推荐信：学校两个关系好的中文系教授写的。
实习：两次高中实习，省级报刊实习。
活动：多次国家级学术夏令营活动，学校社团负责人及一些乱七八糟的市级小奖←话剧类）
还有些乱七八糟的志愿者经历。

出过一本教辅材料←其实还没出版。。
无论文。"
曼尼托巴大学,硕士,Business Administration,录取,2014,1,86.0,,300,双非,艺术教育,77.0,双非,Digital Design,81,Strong work resume and successful business experiences.
香港城市大学,硕士,Engineering Management,录取,2015,2,,6.5,0,211,信息工程（光电子方向）,84.26,,,,"无科研无牛推 小奖 小比赛

年级级长

拿得出手的只有 五百强（在香港很有名很雄厚金融公司的内地公司）实习四个月（不水，核心业务）

gpa<2.5 T_T 本来超级没自信 觉得肯定要gap

现在感觉应该也是可以好好过年"
肯高迪亚大学,硕士,Investment Management,录取,2015,3,103.0,,0,211,金融,89.41,,,,"两个水水的实习：
中国人民银行中心支行支付结算处实习两个月
光大期货分公司实习两个月

一个校二等奖学金，两个校三等奖学金"
印第安纳大学,硕士,Public Administration,录取,2014,4,113.0,,0,浙大/复旦/南大/南开/武大/华中科大/上海交大/天大,工商管理,84.0,,,,
乔治华盛顿大学,硕士,Law,录取,2016,3,103.0,,0,双非,法律,81.0,,,,
西北大学,硕士,Law,录取,2015,4,114.0,,0,清华/北大/中科大,非法学,86.0,,,,"国内律所工作经验6+ （内所+外所）,PRC bar"
维克森林大学,硕士,American Law,录取,2015,2,92.0,,0,211,法学,84.0,,,,一句话说明：田园犬中的学渣犬。好几句话的说明：双学位（金融，60个学分），过司考，14年毕业律所工作不到一年（在当地较为知名的内所），银行、检察院实习，院长、论文指导教授、律所合伙人推，小型公益项目，无牛论文，无交换。
帝国理工学院,硕士,Quantum Fields and Fundamental Forces,录取,2016,0,,,320,国外高校（含港澳台）,数学,86.0,,,,Con: first class
威斯康星大学,博士,East Asian Languages and Literatures,录取,2016,2,98.0,,316,浙大/复旦/南大/南开/武大/华中科大/上海交大/天大,汉语言文学,89.0,211 & 985,中国现当代文学,88,发过几篇论文（一般期刊）+都是学校的奖，奖学金一类的，没有很突出的+社团和实习都没什么突出的
香港中文大学,博士,Cell and Molecular Biology,录取,2015,3,100.0,,318,211 & 985,生物,86.1,,,,"无paper 
有实验室实习 
推荐信一封是学校老师，一封是实验室老板"
特拉华大学,博士,Chemistry,录取,2014,2,99.0,,321,浙大/复旦/南大/南开/武大/华中科大/上海交大/天大,应用化学,81.0,,,,"一篇三作J.Pharm.Sci, 一篇一作Anal.Chem 在审, 一篇一作待投....."
香港浸会大学,硕士,China Studies,录取,2015,2,,6.5,0,双非,社会学,84.5,,,,学校属于双非靠前二本，还有一个香港短期实习，几个相关实习，奖学金、小奖一堆，无牛推荐，无论文，学渣一枚
爱丁堡大学,硕士,Chemistry,录取,2016,2,,6.5,0,211,化学,88.0,,,,无论文，无牛推，水科研，背景无亮点。
香港中文大学,硕士,Comparartive and Public History,录取,2016,2,,6.5,0,双非,汉语言文学,88.0,,,,我就是忘记发这个offer了。。。拒绝中大，去港大，我做的对吗。。。
西北大学,硕士,Law,录取,2016,3,104.0,,0,双非,国际经济法,85.0,,,,
图尔库大学,硕士,Materials Science,录取,2016,2,,6.5,0,211,应用物理,82.46,,,,三无，本校实验室毕设
乔治城大学,硕士,Biotechnology,录取,2015,2,94.0,,313,双非,医学检验,84.0,,,,
香港大学,硕士,Industrial Engineering and Logistics Management,录取,2014,2,,6.5,0,双非,通信工程,83.0,,,,211 三个水实习 无论文无牛推
卡内基梅隆大学,硕士,Civil Engineering,录取,2015,3,104.0,,314,,,85.5,,,,
杜兰大学,博士,Cellular and Molecular Biology,录取,2014,3,106.0,,333,浙大/复旦/南大/南开/武大/华中科大/上海交大/天大,生物,83.0,,,,一年半水研究，无论文无牛腿
康涅狄格大学,博士,Agricultural Economics,录取,2015,0,,,0,双非,经济,91.0,211 & 985,经济,84,
香港城市大学,硕士,Applied Economics,录取,2016,3,100.0,,0,双非,财务管理,88.0,,,,
波士顿大学,硕士,Teaching English as a Second Language,录取,2015,3,107.0,,319,211,英语,88.0,,,,"辅修新闻学双学位，在校园媒体担任过记者和编辑，有一段报社实习经历。另有两段助教实习。
推荐信一封来自学院院长，一封来自专业课老师，一封来自实习单位老师。
参加过大学生自主创新项目。"
香港城市大学,硕士,English Studies,录取,2016,4,,7.5,0,双非,英语,84.46,,,,
辛辛那提大学,硕士,Chemical Engineering,录取,2014,3,104.0,,317,双非,化工,81.0,,,,
香港中文大学,硕士,Marketing,录取,2015,3,,7.0,0,211 & 985,国际经济与贸易,84.0,,,,
香港城市大学,硕士,Creative Media,录取,2017,2,,6.5,0,双非,新闻编导,90.0,,,,两年相关工作经验，一年杂志传媒公司，一年知名互联网总部。大学期间，每年都拿国家励志奖学金和学校特等奖学金，拿过省优秀大学生，其他小奖若干。大学传媒公司和央视实习若干。
香港科技大学,硕士,Social Science,录取,2017,0,,,0,,Psychology,84.0,,,,
爱丁堡大学,硕士,Advanced Sustainable Design,录取,2015,0,,6.0,0,双非,建筑学,82.0,,,,三本独立学院，五年制建筑，11月底申请，无论文，普通任课老师和院长推荐信，一次很水的实习，一次交流项目，一次竞赛获奖，学生干部，在校期间奖学金拿的比较多
德克萨斯大学达拉斯分校,博士,Mechanical Engineering,录取,2016,2,91.0,,320,211 & 985,机械工程,84.0,,,,无科研无论文，GPA本校算法
渥太华大学,硕士,Second Language Education,录取,2014,0,,,0,双非,英语,84.5,双非,语言学,84.5,找了研究生时候的几个老师给写的推荐。论文有三四篇吧，都是工作以后发表的。
谢菲尔德大学,硕士,Landscape Architecture,录取,2015,0,,,0,211,园林,81.0,,,,
香港大学,硕士,Finance,录取,2015,3,106.0,,0,211,工商管理,89.0,,Economics,,
挪威科技大学,硕士,Marine Science,录取,2015,2,97.0,7.0,0,211 & 985,船舶于海洋工程,90.2,,,,国内985.211，只是平均分较高，有半年荷兰经历，科研并无很多。
香港城市大学,硕士,Media Cultures,录取,2016,2,,6.5,0,211,信息管理与信息系统,88.41,,,,国奖，学科竞赛若干，3个社团经验，2项创业竞赛经验，1项互联网公司实习
香港中文大学,硕士,Economics,录取,2015,3,101.0,,0,国外高校（含港澳台）,工商管理,82.5,,,,
香港大学,硕士,English Language Education,录取,2017,4,,7.5,0,211 & 985,英语,84.0,,,,拿过一次国奖，其余每年都有奖学金和校优秀学生.现为中学英语教师。
香港城市大学,硕士,Marketing,录取,2014,0,,,0,浙大/复旦/南大/南开/武大/华中科大/上海交大/天大,,84.0,,,,"3年工作经验，2年4大门户工作经验，到目前为止在国际4A公司。
两封推荐信"
谢菲尔德大学,硕士,Creative and Cultural Industries Management,录取,2015,0,,,0,双非,广播电视编导,88.0,,,,背景挺一般：拿过一些奖学金，最拿的出手的是国奖。得过一些荣誉，除了学校各种优秀学生学生干部之外，得过两个省级的，一个优秀毕业生，一个优秀学生干部。不过我实在不知道外国人对“省级”有没有概念。。。换言之，不知道算不算加分项。水实习只在CV提了两句。在学生会混到副主席，参加过一些志愿者活动，都是小活动，跟那些动辄出国交流出国志愿的没法比。差不多就这些。
新加坡国立大学,硕士,Chinese Studies,录取,2015,4,113.0,,325,双非,对外汉语,87.23,,,,大三英国Nottingham Trent交换一年 (主修English linguistics) 有英国老师推荐信 提交了一篇英文的sample writing
华威大学,硕士,Finance,录取,2015,3,,7.0,0,,会计,84.0,,,,
诺丁汉大学,硕士,Environmental Design,录取,2015,0,,,0,国外高校（含港澳台）,建筑学,86.0,,,,"目前英国利物浦大学建筑系本科在读Final year.

本科是西交利物浦大学建筑系2+2到英国利物浦大学，拿的是英国本科文凭 BA of Architecture 并且还有RIBA PartI，拿到的都是conditional offer，巴斯要求雅思7.0， 其他的也都是要求我能拿到60分以上（upper second class）顺利毕业就好了（UCL 只要了50分 lower second class）。

自学了平面设计的一些理论和软件，有平面设计的工作经验（杂志美编，公司品牌宣传 名片设计等等）纯属本人对设计类相关专业的爱好啦。

目前为止还没有考过雅思。"
香港中文大学,博士,Decision Science,录取,2016,0,,,0,浙大/复旦/南大/南开/武大/华中科大/上海交大/天大,经济学,88.0,国外高校（含港澳台）,MSc in Economics,88,
伦敦大学学院,硕士,Economics and Econometrics,录取,2016,3,109.0,,330,国外高校（含港澳台）,经济,90.0,,,,两段水助研，一封暂且算是牛推的推荐
西弗吉尼亚大学,博士,Chemistry,录取,2015,1,88.0,,311,211 & 985,化学,84.0,,,,"3个项目经历，有一篇二作待投IF大概是6，现在被cc接收了，有一篇写好的没投的。
社会经历里面，做了5年的npo，这一块项目经历比较丰富。"
新加坡国立大学,博士,Mechanical Engineering,录取,2016,2,,6.5,0,浙大/复旦/南大/南开/武大/华中科大/上海交大/天大,能源与环境工程,84.0,211 & 985,能源与动力工程,88,本科期间：空白，空白，还是空白。。研究生期间：流体方向，两篇sci一作(一篇Q1中科院分类top刊，一篇Q2)，三作三篇，国际会议两篇(可是只有博时才能出国交流，我只负责写让他们讲。。)，至于国内期刊或者专利什么的就不说了，都懂的，然后因为上面这些乱七八糟的混了一个硕士国奖(西交能动名额多，运气好。。)
斯蒂文斯理工学院,硕士,Business Intelligence and Analytics,录取,2016,3,100.0,,0,双非,对外汉语&金融&西班牙语,84.0,双非,,,"2水实习
1项目
2奖学金+若干校奖
无论文无牛推"
佐治亚理工学院,博士,Materials & MSE,录取,2013,0,,,329,双非,MSE,88.0,国外高校（含港澳台）,,88,"One paper(IF=6.32), one US patent, 2 international meeting report"
德克萨斯大学奥斯汀分校,硕士,Architecture,录取,2015,3,100.0,,317,双非,建筑,84.0,,,,"申请过程DIY, 无牛推，全是自己系的老师=、="
香港中文大学,硕士,Economics,录取,2015,3,,7.0,324,211 & 985,经济学院,90.0,,,,"4段助研：2段行为与实验经济学+2段发展经济学/           
2段实习：政府+银行/               
3篇水文：水杂志一篇；seminar一篇；参加某论文比赛一篇"
香港城市大学,硕士,Professional Accounting and Corporate Governance,录取,2014,0,,,0,双非,金融,84.0,国外高校（含港澳台）,,,"本科学校从二本升提前批..双非.但全英教学[唯一亮点]无牛推,无发表,水实习两个(一个私人税务所,一个去HK做的美若其名的财富管理)校内主要在学生会打酱油.除了校级设计比赛拿个名次外参加几个商类比赛无果..有参加过HKBU的暑假课程"
华威大学,硕士,Sociology,录取,2017,3,,7.0,0,211,英语,84.0,,,,两个ngo实习，两年校级奖学金
